{"protocol_version":"0.1.0-alpha.3","request_id":"mreq_00000000000000000000000000000002","trace_id":"trace_00000000000000000000000000000002","identity_id":"owner:local","credential_id":"cred_example","credential_generation":1,"timestamp":"2026-10-03T00:00:00Z","nonce":"nonce_write","operation":"system.secrets.register","arguments":{"secret_ref":"secretref://example/item","plugin_id":null},"idempotency_key":"example-write","expected_version":null,"confirmation":null,"signature":"example-signature"}
