{"protocol_version":"0.1.0-alpha.3","request_id":"mreq_00000000000000000000000000000003","trace_id":"trace_00000000000000000000000000000003","identity_id":"owner:local","credential_id":"cred_example","credential_generation":1,"timestamp":"2026-10-03T00:00:00Z","nonce":"nonce_confirm","operation":"system.secrets.revoke","arguments":{"secret_ref":"secretref://example/item"},"idempotency_key":"example-confirmed-write","expected_version":null,"confirmation":{"confirmed":true,"operation":"system.secrets.revoke"},"signature":"example-signature"}
